{"schema":"mana.knowledge.document/v1","index":{"freshness":"current","reason":"source-file-identities-match","revision":"sha256:1111111111111111111111111111111111111111111111111111111111111111"},"document":{"document_id":"doc_111111111111111111111111","source_reference":".mana/global/architecture.md","source_scope":"project","lifecycle_state":"active","title":"Payment Architecture","document_revision":"sha256:2222222222222222222222222222222222222222222222222222222222222222","byte_size":35,"returned_bytes":35,"truncated":false,"passages":[{"passage_id":"psg_111111111111111111111111","ordinal":0,"heading_path":["Payment Architecture"],"body":"Circuit breaker protects payments.","passage_revision":"sha256:3333333333333333333333333333333333333333333333333333333333333333","truncated":false}],"edit_capability":{"available":true,"expected_revision":"sha256:2222222222222222222222222222222222222222222222222222222222222222","exact_content":"Circuit breaker protects payments.","target":".mana/global/architecture.md","source_disclosure":null}},"diagnostics":[]}
